265,Mr. & Mrs. Smith,Action,Weed Road Pictures,"After five (or six) years of vanilla-wedded bliss, ordinary suburbanites John and Jane Smith are stuck in a huge rut. Unbeknownst to each other, they are both coolly lethal, highly-paid assassins working for rival organisations. When they discover they're each other's next target, their secret lives collide in a spicy, explosive mix of wicked comedy, pent-up passion, nonstop action and high-tech weaponry.",1,2005,120,Movie
266,Insurgent,Adventure,Summit Entertainment,Beatrice Prior must confront her inner demons and continue her fight against a powerful alliance which threatens to tear her society apart.,1,2015,119,Movie
267,The Mummy Returns,Adventure,Universal Pictures,"Rick and Evelyn O'Connell, along with their 8 year old son Alex, discover the key to the legendary Scorpion King's might, the fabled Bracelet of Anubis. Unfortunately, a newly resurrected Imhotep has designs on the bracelet as well, and isn't above kidnapping its new bearer, Alex, to gain control of Anubis' otherworldly army.",1,2001,130,Movie
268,The Green Hornet,Action,Original Film,"Britt Reid (Seth Rogen), the heir to the largest newspaper fortune in Los Angeles, is a spoiled playboy who has been, thus far, happy to lead an aimless life. After his father (Tom Wilkinson) dies, Britt meets Kato (Jay Chou), a resourceful company employee. Realizing that they have the talent and resources to make something of their lives, Britt and Kato join forces as costumed crime-fighters to bring down the city's most-powerful criminal, Chudnofsky (Christoph Waltz).",1,2011,119,Movie
269,300: Rise of an Empire,Action,Legendary Pictures,"Based on Frank Miller's latest graphic novel Xerxes and told in the breathtaking visual style of the blockbuster ""300,"" this new chapter of the epic saga takes the action to a fresh battlefield--on the sea--as Greek general Themistokles attempts to unite all of Greece by leading the charge that will change the course of the war. ""300: Rise of an Empire"" pits Themistokles against the massive invading Persian forces led by mortal-turned-god Xerxes and Artemesia, the vengeful commander of the Persian navy.",1,2014,102,Movie
270,The Smurfs,Animation,Columbia Pictures,"When the evil wizard Gargamel chases the tiny blue Smurfs out of their village, they tumble from their magical world and into ours -- in fact, smack dab in the middle of Central Park. Just three apples high and stuck in the Big Apple, the Smurfs must find a way to get back to their village before Gargamel tracks them down.",1,2011,103,Movie
271,Home on the Range,Animation,Walt Disney Pictures,"When a greedy outlaw schemes to take possession of the ""Patch Of Heaven"" dairy farm, three determined cows, a karate-kicking stallion and a colorful corral of critters join forces to save their home. The stakes are sky-high as this unlikely animal alliance risk their hides and match wits with a mysterious band of bad guys.",1,2004,76,Movie
272,Allegiant,Adventure,Summit Entertainment,Beatrice Prior and Tobias Eaton venture into the world outside of the fence and are taken into protective custody by a mysterious agency known as the Bureau of Genetic Welfare.,1,2016,121,Movie
273,Real Steel,Action,DreamWorks SKG,"In the near-future, Charlie Kenton is a washed-up fighter who retired from the ring when robots took over the sport. After Charlie's robot is trashed, he reluctantly teams up with his estranged son Max to rebuild and train an unlikely contender.",1,2011,127,Movie
274,The Smurfs 2,Fantasy,Columbia Pictures,"The evil wizard Gargamel creates a couple of mischievous Smurf-like creatures called the Naughties that he hopes will let him harness the all-powerful, magical Smurf-essence. But when he discovers that only a real Smurf can give him what he wants, and only a secret spell that Smurfette knows can turn the Naughties into real Smurfs, Gargamel kidnaps Smurfette and brings her to Paris, where he has been winning the adoration of millions as the world¹s greatest sorcerer. It's up to Papa, Clumsy, Grouchy, and Vanity to return to our world, reunite with their human friends Patrick and Grace Winslow, and rescue her! Will Smurfette, who has always felt different from the other Smurfs, find a new connection with the Naughties Vexy and Hackus or will the Smurfs convince her that their love for her is True Blue?",1,2013,105,Movie
275,Speed 2: Cruise Control,Action,Twentieth Century Fox Film Corporation,Sandra Bullock and Jason Patric star as a young couple whose dream cruise turns to terror when a lunatic computer genius (Willem Dafoe) sets a new course for destruction.,1,1997,121,Movie
276,Ender's Game,Science Fiction,Summit Entertainment,"Based on the classic novel by Orson Scott Card, Ender's Game is the story of the Earth's most gifted children training to defend their homeplanet in the space wars of the future.",1,2013,114,Movie
277,Live Free or Die Hard,Action,Ingenious Film Partners,"John McClane is back and badder than ever, and this time he's working for Homeland Security. He calls on the services of a young hacker in his bid to stop a ring of Internet terrorists intent on taking control of America's computer infrastructure.",1,2007,128,Movie
278,The Lord of the Rings: The Fellowship of the Ring,Adventure,WingNut Films,"Young hobbit Frodo Baggins, after inheriting a mysterious ring from his uncle Bilbo, must leave his home in order to keep it from falling into the hands of its evil creator. Along the way, a fellowship is formed to protect the ringbearer and make sure that the ring arrives at its final destination: Mt. Doom, the only place where it can be destroyed.",1,2001,178,Movie
279,Osmosis Jones,Adventure,Conundrum Entertainment,"A policeman white blood cell, with the help of a cold pill, must stop a deadly virus from destroying the human they live in, Frank.",1,2001,95,Movie
280,Around the World in 80 Days,Action,Studio Babelsberg,"A bet pits a British inventor, a Chinese thief and a French artist on a worldwide adventure that they can circle the globe in 80 days.",1,2004,120,Movie
281,Ali,Drama,Columbia Pictures Corporation,"In 1964, a brash new pro boxer, fresh from his olympic gold medal victory, explodes on to the scene; Cassius Clay. Bold and outspoken, he cuts an entirely new image for African Americans in sport with his proud public self confidence and his unapologetic belief that he is the greatest boxer of all time. Yet at the top of his game, both Ali's personal and professional lives face the ultimate test.",1,2001,157,Movie
282,The Cat in the Hat,Comedy,Imagine Entertainment,"Conrad and Sally Walden are home alone with their pet fish. It is raining outside, and there is nothing to do. Until The Cat in the Hat walks in the front door. He introduces them to their imagination, and at first it's all fun and games, until things get out of hand, and The Cat must go, go, go, before their parents get back.",1,2003,82,Movie
283,"I, Robot",Action,Twentieth Century Fox Film Corporation,"In 2035, where robots are common-place and abide by the three laws of robotics, a techno-phobic cop investigates an apparent suicide. Suspecting that a robot may be responsible for the death, his investigation leads him to believe that humanity may be in danger.",1,2004,115,Movie
284,Kingdom of Heaven,Drama,Studio Babelsberg,"After his wife dies, a blacksmith named Balian is thrust into royalty, political intrigue and bloody holy wars during the Crusades.",1,2005,144,Movie
285,Stuart Little,Animation,Columbia Pictures Corporation,"The adventures of a heroic and debonair stalwart mouse named Stuart Little with human qualities, who faces some comic misadventures while searching for his lost bird friend and living with a human family as their child.",1,1999,84,Movie
286,The Princess and the Frog,Romance,Walt Disney Pictures,"A waitress, desperate to fulfill her dreams as a restaurant owner, is set on a journey to turn a frog prince back into a human being, but she has to do face the same problem after she kisses him.",1,2009,97,Movie
287,The Martian,Drama,Twentieth Century Fox Film Corporation,"During a manned mission to Mars, Astronaut Mark Watney is presumed dead after a fierce storm and left behind by his crew. But Watney has survived and finds himself stranded and alone on the hostile planet. With only meager supplies, he must draw upon his ingenuity, wit and spirit to subsist and find a way to signal to Earth that he is alive.",1,2015,141,Movie
288,The Island,Action,DreamWorks SKG,"In 2019, Lincoln Six-Echo is a resident of a seemingly ""Utopian"" but contained facility. Like all of the inhabitants of this carefully-controlled environment, Lincoln hopes to be chosen to go to The Island — reportedly the last uncontaminated location on the planet. But Lincoln soon discovers that everything about his existence is a lie.",1,2005,136,Movie
289,Town & Country,Comedy,New Line Cinema,"Porter Stoddard is a well-known New York architect who is at a crossroads... a nexus where twists and turns lead to myriad missteps some with his wife Ellie, others with longtime friends Mona and her husband Griffin. Deciding which direction to take often leads to unexpected encounters with hilarious consequences.",1,2001,104,Movie
290,Gone in Sixty Seconds,Action,Jerry Bruckheimer Films,"Upon learning that he has to come out of retirement to steal 50 cars in one night to save his brother Kip's life, former car thief Randall ""Memphis"" Raines enlists help from a few ""boost happy"" pals to accomplish a seemingly impossible feat. From countless car chases to relentless cops, the high-octane excitement builds as Randall swerves around more than a few roadblocks to keep Kip alive.",1,2000,118,Movie
291,Terminator 2: Judgment Day,Action,Lightstorm Entertainment,"Nearly 10 years have passed since Sarah Connor was targeted for termination by a cyborg from the future. Now her son, John, the future leader of the resistance, is the target for a newer, more deadly terminator. Once again, the resistance has managed to send a protector back to attempt to save John and his mother Sarah.",1,1991,137,Movie
292,Gladiator,Action,DreamWorks SKG,"In the year 180, the death of emperor Marcus Aurelius throws the Roman Empire into chaos. Maximus is one of the Roman army's most capable and trusted generals and a key advisor to the emperor. As Marcus' devious son Commodus ascends to the throne, Maximus is set to be executed. He escapes, but is captured by slave traders. Renamed Spaniard and forced to become a gladiator, Maximus must battle to the death with other men for the amusement of paying audiences. His battle skills serve him well, and he becomes one of the most famous and admired men to fight in the Colosseum. Determined to avenge himself against the man who took away his freedom and laid waste to his family, Maximus believes that he can use his fame and skill in the ring to avenge the loss of his family and former glory. As the gladiator begins to challenge his rule, Commodus decides to put his own fighting mettle to the test by squaring off with Maximus in a battle to the death.",1,2000,155,Movie
293,Minority Report,Action,DreamWorks SKG,"John Anderton is a top 'Precrime' cop in the late-21st century, when technology can predict crimes before they're committed. But Anderton becomes the quarry when another investigator targets him for a murder charge.",1,2002,145,Movie
294,Harry Potter and the Chamber of Secrets,Adventure,1492 Pictures,"Ignoring threats to his life, Harry returns to Hogwarts to investigate – aided by Ron and Hermione – a mysterious series of attacks.",1,2002,161,Movie
295,Casino Royale,Adventure,Eon Productions,"Le Chiffre, a banker to the world's terrorists, is scheduled to participate in a high-stakes poker game in Montenegro, where he intends to use his winnings to establish his financial grip on the terrorist market. M sends Bond – on his maiden mission as a 00 Agent – to attend this game and prevent Le Chiffre from winning. With the help of Vesper Lynd and Felix Leiter, Bond enters the most important poker game in his already dangerous career.",1,2006,144,Movie
296,Planet of the Apes,Thriller,Twentieth Century Fox Film Corporation,"After a spectacular crash-landing on an uncharted planet, brash astronaut Leo Davidson finds himself trapped in a savage world where talking apes dominate the human race. Desperate to find a way home, Leo must evade the invincible gorilla army led by Ruthless General Thade.",1,2001,119,Movie
297,Four Single Fathers,Drama,Indiana Production Company,"A comedy/drama about four Italian single fathers trying to cope with American ex-wives, children, family, and new relationships, set in New York and Rome.",1,2009,100,Movie
298,Public Enemies,History,Universal Pictures,"Depression-era bank robber John Dillinger's charm and audacity endear him to much of America's downtrodden public, but he's also a thorn in the side of J. Edgar Hoover and the fledgling FBI. Desperate to capture the elusive outlaw, Hoover makes Dillinger his first Public Enemy Number One and assigns his top agent, Melvin Purvis, the task of bringing him in dead or alive.",1,2009,140,Movie
299,American Gangster,Drama,Imagine Entertainment,"Following the death of his employer and mentor, Bumpy Johnson, Frank Lucas establishes himself as the number one importer of heroin in the Harlem district of Manhattan. He does so by buying heroin directly from the source in South East Asia and he comes up with a unique way of importing the drugs into the United States. Based on a true story.",1,2007,157,Movie
300,True Lies,Action,Twentieth Century Fox Film Corporation,"Harry Tasker is a secret agent for the United States Government. For years, he has kept his job from his wife, but is forced to reveal his identity and try to stop nuclear terrorists when he and his wife are kidnapped by them.",1,1994,141,Movie
301,The Taking of Pelham 1 2 3,Thriller,Columbia Pictures,"Armed men hijack a New York City subway train, holding the passengers hostage in return for a ransom, and turning an ordinary day's work for dispatcher Walter Garber into a face-off with the mastermind behind the crime.",1,2009,106,Movie
302,Little Fockers,Comedy,Paramount Pictures,"It has taken 10 years, two little Fockers with wife Pam and countless hurdles for Greg to finally get in with his tightly wound father-in-law, Jack. After the cash-strapped dad takes a job moonlighting for a drug company, Jack's suspicions about his favorite male nurse come roaring back. When Greg and Pam's entire clan descends for the twins' birthday party, Greg must prove to the skeptical Jack that he's fully capable as the man of the house.",1,2010,98,Movie
303,The Expendables 2,Action,Nu Image Films,"Mr. Church reunites the Expendables for what should be an easy paycheck, but when one of their men is murdered on the job, their quest for revenge puts them deep in enemy territory and up against an unexpected threat.",1,2012,103,Movie
304,The Other Guys,Action,Columbia Pictures,"NYPD detectives Christopher Danson (Johnson) and P.K. Highsmith (Jackson) are the baddest and most beloved cops in New York City. They don't get tattoos, other men get tattoos of them. Two desks over and one back, sit detectives Allen Gamble (Ferrell) and Terry Hoitz (Wahlberg). You've seen them in the background of photos of Danson and Highsmith, out of focus and eyes closed. They're not heroes, they're ""the other guys."" But every cop has his or her day and soon Gamble and Hoitz stumble into a seemingly innocuous case no other detective wants to touch that could turn into NYC's biggest crime. It's the opportunity of their lives, but do these guys have the right stuff?",1,2010,107,Movie
305,Eraser,Action,Kopelson Entertainment,"U.S. Marshall John Kruger erases the identities of people enrolled in the Witness Protection Program. His current assignment is to protect Lee Cullen, who's uncovered evidence that the weapons manufacturer she works for has been selling to terrorist groups. When Kruger discovers that there's a corrupt agent within the program, he must guard his own life while trying to protect Lee's.",1,1996,115,Movie
306,Django Unchained,Drama,Columbia Pictures,"With the help of a German bounty hunter, a freed slave sets out to rescue his wife from a brutal Mississippi plantation owner.",1,2012,165,Movie
307,The Hunchback of Notre Dame,Drama,Walt Disney Pictures,"When Quasi defies the evil Frollo and ventures out to the Festival of Fools, the cruel crowd jeers him. Rescued by fellow outcast the gypsy Esmeralda, Quasi soon finds himself battling to save the people and the city he loves.",1,1996,91,Movie
308,The Emperor's New Groove,Adventure,Walt Disney Pictures,"Kuzco is a self-centered emperor who summons Pacha from a village and to tell him that his home will be destroyed to make room for Kuzco's new summer home. Kuzco's advisor, Yzma, tries to poison Kuzco and accidentally turns him into a llama, who accidentally ends up in Pacha's village. Pacha offers to help Kuzco if he doesn't destroy his house, and so they form an unlikely partnership.",1,2000,78,Movie
309,The Hurricane,Drama,Universal Pictures,"The story of Rubin ""Hurricane"" Carter, a boxer wrongly imprisoned for murder, and the people who aided in his fight to prove his innocence.",1,1999,146,Movie
310,National Treasure,Adventure,Walt Disney Pictures,"Modern treasure hunters, led by archaeologist Ben Gates, search for a chest of riches rumored to have been stashed away by George Washington, Thomas Jefferson and Benjamin Franklin during the Revolutionary War. The chest's whereabouts may lie in secret clues embedded in the Constitution and the Declaration of Independence, and Gates is in a race to find the gold before his enemies do.",1,2004,131,Movie
311,Eragon,Fantasy,Ingenious Film Partners,"In his homeland of Alagaesia, a farm boy happens upon a dragon's egg -- a discovery that leads him on a predestined journey where he realized he's the one person who can defend his home against an evil king.",1,2006,104,Movie
312,Where the Wild Things Are,Family,Village Roadshow Pictures,"Max imagines running away from his mom and sailing to a far-off land where large talking beasts -- Ira, Carol, Douglas, the Bull, Judith and Alexander -- crown him as their king, play rumpus, build forts and discover secret hideaways.",1,2009,101,Movie
313,Epic,Animation,Blue Sky Studios,A teenager finds herself transported to a deep forest setting where a battle between the forces of good and the forces of evil is taking place. She bands together with a rag-tag group characters in order to save their world -- and ours.,1,2013,102,Movie
314,The Tourist,Action,Columbia Pictures,"American tourist Frank (Johnny Depp) meets mysterious British woman Elsie (Angelina Jolie) on the train to Venice. Romance seems to bud, but there's more to her than meets the eye. Remake of the 2005 French film ""Anthony Zimmer"", written and directed by Jérôme Salle.",1,2010,103,Movie
315,End of Days,Action,Beacon Communications,"On December 28th, 1999, the citizens of New York City are getting ready for the turn of the millennium. However, the Devil decides to crash the party by coming to the city, inhabiting a man's body, and searching for his chosen bride, a 20-year-old woman named Christine York. The world will end, and the only hope lies within an atheist called Jericho Cane.",1,1999,121,Movie
316,Blood Diamond,Drama,Bedford Falls Productions,"An ex-mercenary turned smuggler. A Mende fisherman. Amid the explosive civil war overtaking 1999 Sierra Leone, these men join for two desperate missions: recovering a rare pink diamond of immense value and rescuing the fisherman's son conscripted as a child soldier into the brutal rebel forces ripping a swath of torture and bloodshed countrywide.",1,2006,143,Movie
317,The Wolf of Wall Street,Crime,Paramount Pictures,"A New York stockbroker refuses to cooperate in a large securities fraud case involving corruption on Wall Street, corporate banking world and mob infiltration. Based on Jordan Belfort's autobiography.",1,2013,180,Movie
318,Batman Forever,Action,Warner Bros.,"The Dark Knight of Gotham City confronts a dastardly duo: Two-Face and the Riddler. Formerly District Attorney Harvey Dent, Two-Face believes Batman caused the courtroom accident which left him disfigured on one side. And Edward Nygma, computer-genius and former employee of millionaire Bruce Wayne, is out to get the philanthropist; as The Riddler. Former circus acrobat Dick Grayson, his family killed by Two-Face, becomes Wayne's ward and Batman's new partner Robin.",1,1995,121,Movie
319,Starship Troopers,Adventure,TriStar Pictures,"Set in the future, the story follows a young soldier named Johnny Rico and his exploits in the Mobile Infantry. Rico's military career progresses from recruit to non-commissioned officer and finally to officer against the backdrop of an interstellar war between mankind and an arachnoid species known as ""the Bugs"".",1,1997,129,Movie
320,Cloud Atlas,Drama,Anarchos Productions,"A set of six nested stories spanning time between the 19th century and a distant post-apocalyptic future. Cloud Atlas explores how the actions and consequences of individual lives impact one another throughout the past, the present and the future. Action, mystery and romance weave through the story as one soul is shaped from a killer into a hero and a single act of kindness ripples across centuries to inspire a revolution in the distant future.  Based on the award winning novel by David Mitchell. Directed by Tom Tykwer and the Wachowskis.",1,2012,172,Movie
321,Legend of the Guardians: The Owls of Ga'Hoole,Animation,Village Roadshow Pictures,"Soren, a young barn owl, is kidnapped by owls of St. Aggie's, ostensibly an orphanage, where owlets are brainwashed into becoming soldiers. He and his new friends escape to the island of Ga'Hoole, to assist its noble, wise owls who fight the army being created by the wicked rulers of St. Aggie's. The film is based on the first three books in the series.",1,2010,97,Movie
322,Catwoman,Action,Village Roadshow Pictures,"Liquidated after discovering a corporate conspiracy, mild-mannered graphic artist Patience Phillips washes up on an island, where she's resurrected and endowed with the prowess of a cat -- and she's eager to use her new skills ... as a vigilante. Before you can say ""cat and mouse,"" handsome gumshoe Tom Lone is on her tail.",1,2004,104,Movie
323,Hercules,Action,Paramount Pictures,"Fourteen hundred years ago, a tormented soul walked the earth that was neither man nor god. Hercules was the powerful son of the god king Zeus, for this he received nothing but suffering his entire life. After twelve arduous labors and the loss of his family, this dark, world-weary soul turned his back on the gods finding his only solace in bloody battle. Over the years he warmed to the company of six similar souls, their only bond being their love of fighting and presence of death. These men and woman never question where they go to fight or why or whom, just how much they will be paid. Now the King of Thrace has hired these mercenaries to train his men to become the greatest army of all time. It is time for this bunch of lost souls to finally have their eyes opened to how far they have fallen when they must train an army to become as ruthless and blood thirsty as their reputation has become.",1,2014,99,Movie
324,Treasure Planet,Adventure,Walt Disney Pictures,"When space galleon cabin boy Jim Hawkins discovers a map to an intergalactic ""loot of a thousand worlds,"" a cyborg cook named John Silver teaches him to battle supernovas and space storms. But, soon, Jim realizes Silver is a pirate intent on mutiny!",1,2002,95,Movie
325,Land of the Lost,Adventure,Universal Pictures,"On his latest expedition, Dr. Rick Marshall is sucked into a space-time vortex alongside his research assistant and a redneck survivalist. In this alternate universe, the trio make friends with a primate named Chaka, their only ally in a world full of dinosaurs and other fantastic creatures.",1,2009,102,Movie
326,The Peanuts Movie,Animation,Blue Sky Studios,"Snoopy embarks upon his greatest mission as he and his team take to the skies to pursue their arch-nemesis, while his best pal Charlie Brown begins his own epic quest back home.",1,2015,88,Movie
327,葉問3,Action,Mandarin Films Distribution Co.,"When a band of brutal gangsters led by a crooked property developer make a play to take over the city, Master Ip is forced to take a stand.",1,2015,105,Movie
328,The Expendables 3,Action,Davis-Films,"Barney, Christmas and the rest of the team comes face-to-face with Conrad Stonebanks, who years ago co-founded The Expendables with Barney. Stonebanks subsequently became a ruthless arms trader and someone who Barney was forced to kill… or so he thought. Stonebanks, who eluded death once before, now is making it his mission to end The Expendables -- but Barney has other plans. Barney decides that he has to fight old blood with new blood, and brings in a new era of Expendables team members, recruiting individuals who are younger, faster and more tech-savvy. The latest mission becomes a clash of classic old-school style versus high-tech expertise in the Expendables’ most personal battle yet.",1,2014,127,Movie
329,Point Break,Action,Studio Babelsberg,"A young undercover FBI agent infiltrates a gang of thieves who share a common interest in extreme sports. A remake of the 1991 film, ""Point Break"".",1,2015,114,Movie
330,Son of the Mask,Fantasy,New Line Cinema,"Tim Avery, an aspiring cartoonist, finds himself in a predicament when his dog stumbles upon the mask of Loki. Then after conceiving an infant son ""born of the mask"", he discovers just how looney child raising can be.",1,2005,94,Movie
