468,Con Air,Action,Jerry Bruckheimer Films,"When the government puts all its rotten criminal eggs in one airborne basket, it's asking for trouble. Before you can say, ""Pass the barf bag,"" the crooks control the plane, led by creepy Cyrus ""The Virus"" Grissom. Watching his every move is the just-released Cameron Poe, who'd rather reunite with his family.",1,1997,115,Movie
469,Eagle Eye,Mystery,DreamWorks SKG,"Jerry Shaw and Rachel Holloman are two strangers whose lives are suddenly thrown into turmoil by a mysterious woman they have never met. Threatening their lives and family, the unseen caller uses everyday technology to control their actions and push them into increasing danger. As events escalate, Jerry and Rachel become the country's most-wanted fugitives and must figure out what is happening to them.",1,2008,118,Movie
470,Cold Mountain,Drama,Miramax Films,"In this classic story of love and devotion set against the backdrop of the American Civil War, a wounded Confederate soldier named W.P. Inman deserts his unit and travels across the South, aiming to return to his young wife, Ada, who he left behind to tend their farm. As Inman makes his perilous journey home, Ada struggles to keep their home intact with the assistance of Ruby, a mysterious drifter sent to help her by a kindly neighbor.",1,2003,154,Movie
471,Flubber,Comedy,Walt Disney Pictures,"Professor Phillip Brainard, an absent minded professor, works with his assistant Weebo, trying to create a substance that's a new source of energy and that will save Medfield College where his sweetheart Sara is the president. He has missed his wedding twice, and on the afternoon of his third wedding, Professor Brainard creates flubber, which allows objects to fly through the air.",1,1997,93,Movie
472,The Haunting,Horror,DreamWorks,"Dr. David Marrow invites Nell Vance, and Theo and Luke Sanderson to the eerie and isolated Hill House to be subjects for a sleep disorder study. The unfortunate guests discover that Marrow is far more interested in the sinister mansion itself – and they soon see the true nature of its horror.",1,1999,113,Movie
473,Space Jam,Animation,Warner Bros. Family Entertainment,"In a desperate attempt to win a basketball match and earn their freedom, the Looney Tunes seek the aid of retired basketball champion, Michael Jordan.",1,1996,88,Movie
474,The Pink Panther,Action,Columbia Pictures,"When the coach of the France soccer team is killed by a poisoned dart in the stadium in the end of a game, and his expensive and huge ring with the diamond Pink Panther disappears, the ambitious Chief Inspector Dreyfus assigns the worst police inspector Jacques Clouseau to the case.",1,2006,93,Movie
512,A Sound of Thunder,Thriller,Epsilon Motion Pictures,"When a hunter sent back to the prehistoric era runs off the path he must not leave, he causes a chain reaction that alters history in disastrous ways.",1,2005,110,Movie
475,The Day the Earth Stood Still,Drama,Twentieth Century Fox Film Corporation,"A representative of an alien race that went through drastic evolution to survive its own climate change, Klaatu comes to Earth to assess whether humanity can prevent the environmental damage they have inflicted on their own planet. When barred from speaking to the United Nations, he decides humankind shall be exterminated so the planet can survive.",1,2008,104,Movie
476,Red Planet,Thriller,Village Roadshow Pictures,"Astronauts search for solutions to save a dying Earth by searching on Mars, only to have the mission go terribly awry.",1,2000,106,Movie
477,Conspiracy Theory,Action,Silver Pictures,"A man obsessed with conspiracy theories becomes a target after one of his theories turns out to be true. Unfortunately, in order to save himself, he has to figure out which theory it is.",1,1997,135,Movie
478,Fury,War,Columbia Pictures,"Last months of World War II in April 1945. As the Allies make their final push in the European Theater, a battle-hardened U.S. Army sergeant in the 2nd Armored Division named Wardaddy commands a Sherman tank called ""Fury"" and its five-man crew on a deadly mission behind enemy lines. Outnumbered and outgunned, Wardaddy and his men face overwhelming odds in their heroic attempts to strike at the heart of Nazi Germany.",1,2014,135,Movie
479,Six Days Seven Nights,Action,Caravan Pictures,"When Quinn, a grouchy pilot living the good life in the South Pacific, agrees to transfer a savvy fashion editor, Robin, to Tahiti, he ends up stranded on a deserted island with her after their plane crashes. The pair avoid each other at first, until they're forced to team up to escape from the island -- and some pirates who want their heads.",1,1998,98,Movie
480,Yogi Bear,Comedy,De Line Pictures,"Jellystone Park has been losing business, so greedy Mayor Brown decides to shut it down and sell the land. That means families will no longer be able to experience the natural beauty of the outdoors -- and, even worse, Yogi and Boo Boo will be tossed out of the only home they've ever known. Faced with his biggest challenge ever, Yogi must prove that he really is ""smarter than the average bear"" as he and Boo Boo join forces with their old nemesis Ranger Smith to find a way to save Jellystone Park from closing forever.",1,2010,80,Movie
481,Spirit: Stallion of the Cimarron,Western,DreamWorks SKG,"As a wild stallion travels across the frontiers of the Old West, he befriends a young human and finds true love with a mare.",1,2002,83,Movie
482,Zookeeper,Comedy,Columbia Pictures,"A comedy about a zookeeper who might be great with animals, but he doesn't know anything about the birds and the bees. The man can't find love, so he decides to quit his job at the zoo, but his animal friends try to stop him and teach him that Mother Nature knows best when it comes to love.",1,2011,102,Movie
483,The Manchurian Candidate,Drama,Paramount Pictures,"When his army unit was ambushed during the first Gulf War, Sergeant Raymond Shaw saved his fellow soldiers just as his commanding officer, then-Captain Ben Marco, was knocked unconscious. Brokering the incident for political capital, Shaw eventually becomes a vice-presidential nominee, while Marco is haunted by dreams of what happened -- or didn't happen -- in Kuwait. As Marco (now a Major) investigates, the story begins to unravel, to the point where he questions if it happened at all. Is it possible the entire unit was kidnapped and brainwashed to believe Shaw is a war hero as part of a plot to seize the White House? Some very powerful people at Manchurian Global corporation appear desperate to stop him from finding out.",1,2004,129,Movie
484,Déjà Vu,Romance,"Rainbow Film Company, The","L.A. shop owner Dana and Englishman Sean meet and fall in love at first sight, but Sean is married and Dana is to marry her business partner Alex.",1,1998,117,Movie
485,Hotel Transylvania 2,Animation,Columbia Pictures,"When the old-old-old-fashioned vampire Vlad arrives at the hotel for an impromptu family get-together, Hotel Transylvania is in for a collision of supernatural old-school and modern day cool.",1,2015,89,Movie
486,Fantasia 2000,Animation,Walt Disney Pictures,"Blending lively music and brilliant animation, this sequel to the original 'Fantasia' restores 'The Sorcerer's Apprentice' and adds seven new shorts.",1,1999,74,Movie
487,The Time Machine,Science Fiction,DreamWorks SKG,"Hoping to alter the events of the past, a 19th century inventor instead travels 800,000 years into the future, where he finds humankind divided into two warring races.",1,2002,96,Movie
488,Mighty Joe Young,Action,Walt Disney Pictures,"As a child living in Africa, Jill Young saw her mother killed while protecting wild gorillas from poachers led by Andrei Strasser. Now an adult, Jill cares for an orphaned gorilla named Joe -- who, due to a genetic anomaly, is 15 feet tall. When Gregg O'Hara arrives from California and sees the animal, he convinces Jill that Joe would be safest at his wildlife refuge. But Strasser follows them to the U.S., intent on capturing Joe for himself.",1,1998,114,Movie
489,Swordfish,Action,Village Roadshow Pictures,"Rogue agent Gabriel Shear is determined to get his mitts on $9 billion stashed in a secret Drug Enforcement Administration account. He wants the cash to fight terrorism, but lacks the computer skills necessary to hack into the government mainframe. Enter Stanley Jobson, a n'er-do-well encryption expert who can log into anything.",1,2001,99,Movie
490,三国之见龙卸甲,Action,Visualizer Film Productions,"The aging Zhao embarks on his final and greatest campaign, a road to adventure that will crown his name in glory for all time.",1,2008,102,Movie
491,The Legend of Zorro,Action,Amblin Entertainment,"Having spent the last 10 years fighting injustice and cruelty, Alejandro de la Vega is now facing his greatest challenge: his loving wife Elena has thrown him out of the house!  Elena has filed for divorce and found comfort in the arms of Count Armand, a dashing French aristocrat.  But Alejandro knows something she doesn't: Armand is the evil mastermind behind a terrorist plot to destroy the United States.  And so, with his marriage and the county's future at stake, it's up to Zorro to save two unions before it's too late.",1,2005,129,Movie
492,What Dreams May Come,Drama,PolyGram Filmed Entertainment,"Chris Neilson dies to find himself in a heaven more amazing than he could have ever dreamed of. There is one thing missing: his wife. After he dies, his wife, Annie killed herself and went to hell. Chris decides to risk eternity in hades for the small chance that he will be able to bring her back to heaven.",1,1998,113,Movie
493,Little Nicky,Comedy,New Line Cinema,"After the lord of darkness decides he will not cede his thrown to any of his three sons, the two most powerful of them escape to Earth to create a kingdom for themselves. This action closes the portal filtering sinful souls to Hell and causes Satan to wither away. He must send his most weak but beloved son, Little Nicky, to Earth to return his brothers to Hell.",1,2000,90,Movie
884,Chain Reaction,Action,Twentieth Century Fox Film Corporation,Two researchers in a green alternative energy project are put on the run when they are framed for murder and treason.,1,1996,107,Movie
494,The Brothers Grimm,Adventure,The Weinstein Company,"Folklore collectors and con artists, Jake and Will Grimm, travel from village to village pretending to protect townsfolk from enchanted creatures and performing exorcisms. However, they are put to the test  when they encounter a real magical curse in a haunted forest with real magical beings, requiring genuine courage.",1,2005,118,Movie
495,Mars Attacks!,Comedy,Tim Burton Productions,"'We come in peace' is not what those green men from Mars mean when they invade our planet, armed with irresistible weapons and a cruel sense of humor.  This star studded cast must play victim to the alien’s fun and games in this comedy homage to science fiction films of the '50s and '60s.",1,1996,106,Movie
496,Évolution,Mystery,Ex Nihilo,11-year-old Nicolas lives with his mother in a seaside housing estate. The only place that ever sees any activity is the hospital. It is there that all the boys from the village are forced to undergo strange medical trials that attempt to disrupt the phases of evolution.,1,2015,81,Movie
497,The Edge,Action,Art Linson Productions,"The plane carrying wealthy Charles Morse crashes down in the Alaskan wilderness. Together with the two other passengers, photographer Robert and assistant Stephen, Charles devises a plan to help them reach civilization. However, his biggest obstacle might not be the elements, or even the Kodiak bear stalking them -- it could be Robert, whom Charles suspects is having an affair with his wife and would not mind seeing him dead.",1,1997,117,Movie
498,Surrogates,Action,Touchstone Pictures,"Set in a futuristic world where humans live in isolation and interact through surrogate robots, a cop is forced to leave his home for the first time in years in order to investigate the murders of others' surrogates.",1,2009,89,Movie
499,Thirteen Days,Drama,New Line Cinema,"Dramatisation of the Cuban Missile Crisis, the nuclear standoff with the USSR sparked by the discovery by the Americans of missle bases established on the Soviet allied island of Cuba. Shown from the perspective of the US President, John F Kennedy, his staff and advisors.",1,2000,145,Movie
500,Daylight,Action,Universal Pictures,A group of armed robbers fleeing the police head for the New Jersey Tunnel and run right into trucks transporting toxic waste. The spectacular explosion that follows results in both ends of the tunnel collapsing and the handful of people who survived the explosion are now in peril. Kit Latura is the only man with the skill and knowledge to lead the band of survivors out of the tunnel before the structure collapses.,1,1996,115,Movie
501,Walking With Dinosaurs,Animation,BBC Worldwide,"Walking with Dinosaurs 3D is a film depicting life-like 3D dinosaur characters set in photo-real landscapes that transports audiences to the prehistoric world as it existed 70 million years ago. The film is based on the 1999 documentary television miniseries Walking with Dinosaurs, produced by the BBC. Walking with Dinosaurs 3D is being produced by Evergreen Studios, the company that produced Happy Feet, and it is was released on October 11, 2013.",1,2013,87,Movie
502,Battlefield Earth,Action,Franchise Pictures,"In the year 3000, man is no match for the Psychlos, a greedy, manipulative race of aliens on a quest for ultimate profit. Led by the powerful Terl, the Psychlos are stripping Earth clean of its natural resources, using the broken remnants of humanity as slaves. What is left of the human race has descended into a near primitive state. After being captured, it is up to Tyler to save mankind.",1,2000,118,Movie
503,Looney Tunes: Back in Action,Animation,Lonely Film Productions GmbH & Co. KG.,"Bugs Bunny and Daffy Duck are up to their feuding ways again. Tired of playing second fiddle to Bugs, Daffy has decided to leave the Studio for good. He is aided by Warner Bros.' humor impaired Vice President of Comedy, Kate Houghton, who releases him from his contract and instructs WB security guard/aspiring stunt man DJ Drake to capture and ""escort"" Daffy off the studio lot.",1,2003,90,Movie
504,Nine,Drama,The Weinstein Company,"Arrogant, self-centered movie director Guido Contini finds himself struggling to find meaning, purpose, and a script for his latest film endeavor. With only a week left before shooting begins, he desperately searches for answers and inspiration from his wife, his mistress, his muse, and his mother.",1,2009,112,Movie
505,Timeline,Action,Paramount Pictures,A group of archaeological students become trapped in the past when they go there to retrieve their professor. The group must survive in 14th century France long enough to be rescued.,1,2003,116,Movie
506,The Postman,Drama,Tig Productions,"In 2013 there are no highways, no I-ways, no dreams of a better tomorrow, only scattered survivors across what was once the Unites States. Into this apocalyptic wasteland comes an enigmatic drifter with a mule, a knack for Shakespeare and something yet undiscovered: the power to inspire hope.",1,1997,177,Movie
507,Babe: Pig in the City,Adventure,Kennedy Miller Productions,"Babe, fresh from his victory in the sheepherding contest, returns to Farmer Hoggett's farm, but after Farmer Hoggett is injured and unable to work, Babe has to go to the big city to save the farm.",1,1998,92,Movie
508,The Last Witch Hunter,Fantasy,Summit Entertainment,"The modern world holds many secrets, but by far the most astounding is that witches still live among us; vicious supernatural creatures intent on unleashing the Black Death upon the world and putting an end to the human race once and for all. Armies of witch hunters have battled this unnatural enemy for centuries, including Kaulder, a valiant warrior who many years ago slayed the all-powerful Witch Queen, decimating her followers in the process. In the moments right before her death, the Queen cursed Kaulder with immortality, forever separating him from his beloved wife and daughter. Today, Kaulder is the last living hunter who has spent his immortal life tracking down rogue witches, all the while yearning for his long-lost family.",1,2015,106,Movie
509,逃出生天,Action,Sun Entertainment Culture,"On the hottest day in 50 years, a serious fire incident happened to a busy commercial tower, a gaggle of fire fighters with an indestructible enthusiasm are going to save lives.",1,2013,107,Movie
510,Arthur et les Minimoys,Adventure,Canal Plus,"Arthur is a spirited ten-year old whose parents are away looking for work, whose eccentric grandfather has been missing for several years, and who lives with his grandmother in a country house that, in two days, will be repossessed, torn down, and turned into a block of flats unless Arthur's grandfather returns to sign some papers and pay off the family debt. Arthur discovers that the key to success lies in his own descent into the land of the Minimoys, creatures no larger than a tooth, whom his grandfather helped relocate to their garden. Somewhere among them is hidden a pile of rubies, too. Can Arthur be of stout heart and save the day? Romance beckons as well, and a villain lurks.",1,2006,94,Movie
511,Oceans,Documentary,Pathé Films,"An ecological drama/documentary, filmed throughout the globe. Part thriller, part meditation on the vanishing wonders of the sub-aquatic world.",1,2009,84,Movie
513,Pompeii,Action,Impact Pictures,"Set in 79 A.D., POMPEII tells the epic story of Milo, a slave turned invincible gladiator who finds himself in a race against time to save his true love Cassia, the beautiful daughter of a wealthy merchant who has been unwillingly betrothed to a corrupt Roman Senator. As Mount Vesuvius erupts in a torrent of blazing lava, Milo must fight his way out of the arena in order to save his beloved as the once magnificent Pompeii crumbles around him.",1,2014,105,Movie
514,Don Gato: El inicio de la pandilla,Comedy,Anima Estudios,Top Cat has arrived to charm his way into your hearts! Ever wonder how this scheming feline got his start? Well Top Cat Begins reveals the origins of everything you know and love about this classic comedy hero. What follows is an adventure so crazy that it has to be seen to be believed!,1,2015,89,Movie
515,Step Up Revolution,Music,Summit Entertainment,"Emily arrives in Miami with aspirations to become a professional dancer. She sparks with Sean, the leader of a dance crew whose neighborhood is threatened by Emily's father's development plans.",1,2012,99,Movie
516,A Beautiful Mind,Drama,Imagine Entertainment,"At Princeton University, John Nash struggles to make a worthwhile contribution to serve as his legacy to the world of mathematics. He finally makes a revolutionary breakthrough that will eventually earn him the Nobel Prize. After graduate school he turns to teaching, becoming romantically involved with his student Alicia. Meanwhile the government asks his help with breaking Soviet codes, which soon gets him involved in a terrifying conspiracy plot. Nash grows more and more paranoid until a discovery that turns his entire world upside down. Now it is only with Alicia's help that he will be able to recover his mental strength and regain his status as the great mathematician we know him as today..",1,2001,135,Movie
517,The Lion King,Family,Walt Disney Pictures,A young lion cub named Simba can't wait to be king. But his uncle craves the title for himself and will stop at nothing to get it.,1,1994,89,Movie
518,Journey 2: The Mysterious Island,Adventure,New Line Cinema,"Sean Anderson partners with his mom's boyfriend on a mission to find his grandfather, who is thought to be missing on a mythical island.",1,2012,94,Movie
519,Cloudy with a Chance of Meatballs 2,Animation,Columbia Pictures,"After the disastrous food storm in the first film, Flint and his friends are forced to leave the town. Flint accepts the invitation from his idol Chester V to join The Live Corp Company, which has been tasked to clean the island, and where the best inventors in the world create technologies for the betterment of mankind. When Flint discovers that his machine still operates and now creates mutant food beasts like living pickles, hungry tacodiles, shrimpanzees and apple pie-thons, he and his friends must return to save the world.",1,2013,95,Movie
520,Red Dragon,Crime,Universal Pictures,"Former FBI Agent Will Graham, who was once almost killed by the savage Hannibal 'The Cannibal' Lecter, now has no choice but to face him again, as it seems Lecter is the only one who can help Graham track down a new serial killer.",1,2002,124,Movie
521,Hidalgo,Western,Casey Silver Productions,"Set in 1890, this is the story of a Pony Express courier who travels to Arabia to compete with his horse, Hidalgo, in a dangerous race for a massive contest prize, in an adventure that sends the pair around the world...",1,2004,136,Movie
522,Jack and Jill,Comedy,Columbia Pictures,"Jack Sadelstein, a successful advertising executive in Los Angeles with a beautiful wife and kids, dreads one event each year: the Thanksgiving visit of his twin sister Jill. Jill's neediness and passive-aggressiveness is maddening to Jack, turning his normally tranquil life upside down.",1,2011,91,Movie
523,How to Be Single,Comedy,New Line Cinema,"New York City is full of lonely hearts seeking the right match, and what Alice, Robin, Lucy, Meg, Tom and David all have in common is the need to learn how to be single in a world filled with ever-evolving definitions of love.",1,2016,110,Movie
524,2 Fast 2 Furious,Action,Mikona Productions GmbH & Co. KG,"It's a major double-cross when former police officer Brian O'Conner teams up with his ex-con buddy Roman Pearce to transport a shipment of ""dirty"" money for shady Miami-based import-export dealer Carter Verone. But the guys are actually working with undercover agent Monica Fuentes to bring Verone down.",1,2003,107,Movie
525,The Little Prince,Adventure,Onyx Films,"Based on the best-seller book 'The Little Prince', the movie tells the story of a little girl that lives with resignation in a world where efficiency and work are the only dogmas. Everything will change when accidentally she discovers her neighbor that will tell her about the story of the Little Prince that he once met.",1,2015,92,Movie
526,The Invasion,Science Fiction,Village Roadshow Pictures,"Washington, D.C. psychologist Carol Bennell and her colleague Dr. Ben Driscoll are the only two people on Earth who are aware of an epidemic running rampant through the city. They discover an alien virus aboard a crashed space shuttle that transforms anyone who comes into contact with it into unfeeling drones while they sleep. Carol realizes her son holds the key to stopping the spread of the plague and she races to find him before it is too late.",1,2007,99,Movie
527,The Adventures of Rocky & Bullwinkle,Action,Universal Pictures,"Rocky and Bullwinkle have been living off the finances made from the reruns of their cartoon show. Boris and Natasha somehow manage to crossover into reality and team up with Fearless Leader, an evil criminal turned media mogul with some evil plans up his sleeve. Rocky and Bullwinkle must stop the three of them before they wreak havoc.",1,2000,88,Movie
528,The Secret Life of Pets,Animation,Universal Pictures,"The quiet life of a terrier named Max is upended when his owner takes in Duke, a stray whom Max instantly dislikes.",1,2016,87,Movie
529,The League of Extraordinary Gentlemen,Fantasy,Twentieth Century Fox Film Corporation,"To prevent a world war from breaking out, famous characters from Victorian literature band together to do battle against a cunning villain.",1,2003,110,Movie
530,Independence Day,Action,Twentieth Century Fox Film Corporation,"On July 2, a giant alien mothership enters orbit around Earth and deploys several dozen saucer-shaped 'destroyer' spacecraft that quickly lay waste to major cities around the planet. On July 3, the United States conducts a coordinated counterattack that fails. On July 4, a plan is devised to gain access to the interior of the alien mothership in space, in order to plant a nuclear missile.",1,1996,145,Movie
531,The Lost World: Jurassic Park,Adventure,Universal Pictures,"Four years after Jurassic Park's genetically bred dinosaurs ran amok, multimillionaire John Hammond shocks chaos theorist Ian Malcolm by revealing that Hammond has been breeding more beasties at a secret location. Malcolm, his paleontologist ladylove and a wildlife videographer join an expedition to document the lethal lizards' natural behavior in this action-packed thriller.",1,1997,129,Movie
532,Madagascar,Family,DreamWorks SKG,"Zoo animals leave the comforts of man-made habitats for exotic adventure in this animated family film. After escaping from the zoo, four friends -- a lion, a hippo, a zebra and a giraffe -- are sent back to Africa. When their ship capsizes, stranding them on Madagascar, an island populated by crazy critters, the pals must adapt to jungle life and their new roles as wild animals.",1,2005,86,Movie
533,Children of Men,Drama,Universal Pictures,"In 2027, in a chaotic world in which humans can no longer procreate, a former activist agrees to help transport a miraculously pregnant woman to a sanctuary at sea, where her child's birth may help scientists save the future of humankind.",1,2006,109,Movie
534,X-Men,Adventure,Twentieth Century Fox Film Corporation,"Two mutants, Rogue and Wolverine, come to a private academy for their kind whose resident superhero team, the X-Men, must oppose a terrorist organization with similar powers.",1,2000,104,Movie
