672,Focus,Romance,Kramer & Sigman Films,"Nicky, a veteran con artist, takes a novice named Jess under his wing. While Nicky teaches Jess the tricks of the trade, the pair become romantically involved; but, when Jess gets uncomfortably close, Nicky ends their relationship. Three years later, Nicky is in Buenos Aires working a very dangerous scheme when Jess -- now an accomplished femme fatale -- unexpectedly shows up. Her appearance throws Nicky for a loop at a time when he cannot afford to be off his game.",1,2015,105,Movie
673,Broken Arrow,Action,Twentieth Century Fox Film Corporation,"When rogue stealth-fighter pilot Vic Deakins deliberately drops off the radar while on maneuvers, the Air Force ends up with two stolen nuclear warheads -- and Deakins's co-pilot, Riley Hale, is the military's only hope for getting them back. Traversing the deserted canyons of Utah, Hale teams with park ranger Terry Carmichael to put Deakins back in his box.",1,1996,108,Movie
674,The Kid,Fantasy,Walt Disney Pictures,"Powerful businessman Russ Duritz is self-absorbed and immersed in his work. But by the magic of the moon, he meets Rusty, a chubby, charming 8-year-old version of himself who can't believe he could turn out so badly -- with no life and no dog. With Rusty's help, Russ is able to reconcile the person he used to dream of being with the man he's actually become.",1,2000,104,Movie
675,World Trade Center,Drama,Paramount Pictures,"On September, 11th 2001, after the terrorist attack to the World Trade Center, the building collapses over the rescue team from the Port Authority Police Department. Will Jimeno and his sergeant John McLoughlin are found alive trapped under the wreckage while the rescue teams fight to save them.",1,2006,128,Movie
676,Mona Lisa Smile,Drama,Columbia Pictures,"The story of Katherine Ann Watson, a feminist teacher who studied at UCLA graduate school and in 1953 left her boyfriend behind in Los Angeles, California to teach at Wellesley College, a conservative women's private liberal arts college in Massachusetts, United States.",1,2003,117,Movie
677,The Dictator,Comedy,Paramount Pictures,The heroic story of a dictator who risks his life to ensure that democracy would never come to the country he so lovingly oppressed.,1,2012,83,Movie
678,Eyes Wide Shut,Mystery,Hobby Films,"After Dr. Bill Hartford's wife, Alice, admits to having sexual fantasies about a man she met, Bill becomes obsessed with having a sexual encounter. He discovers an underground sexual group and attends one of their meetings -- and quickly discovers that he is in over his head.",1,1999,159,Movie
679,Annie,Comedy,Columbia Pictures,"Ever since her parents left her as a baby, little Annie has led a hard-knock life with her calculating foster mother, Miss Hannigan. However, all that changes when hard-nosed billionaire and mayoral candidate Will Stacks takes her in on the recommendation of his advisers. Stacks believes that he's Annie's guardian angel, but the plucky youngster's confidence and sunny outlook may mean that Annie will save Will instead.",1,2014,119,Movie
680,Blade: Trinity,Science Fiction,New Line Cinema,"For years, Blade has fought against the vampires in the cover of the night. But now, after falling into the crosshairs of the FBI, he is forced out into the daylight, where he is driven to join forces with a clan of human vampire hunters he never knew existed - The Nightstalkers. Together with Abigail and Hannibal, two deftly trained Nightstalkers, Blade follows a trail of blood to the ancient creature that is also hunting him, the original vampire, Dracula.",1,2004,123,Movie
681,Red Dawn,Action,United Artists,"It is the mid-1980s. From out of the sky, Soviet and Cuban troops begin landing on the football field of a Colorado high school. In seconds, the paratroops have attacked the school and sent a group of teenagers fleeing into the mountains. Armed only with hunting rifles, pistols and bows and arrows, the teens struggles to survive the bitter winter and Soviet KGB patrols hunting for them.",1,1984,114,Movie
682,Primary Colors,Comedy,Universal Pictures,"In this adaptation of the best-selling roman à clef about Bill Clinton's 1992 run for the White House, the young and gifted Henry Burton is tapped to oversee the presidential campaign of Governor Jack Stanton. Burton is pulled into the politician's colorful world and looks on as Stanton -- who has a wandering eye that could be his downfall -- contends with his ambitious wife, Susan, and an outspoken adviser, Richard Jemmons.",1,1998,143,Movie
683,Resident Evil: Retribution,Action,Davis-Films,"The Umbrella Corporation’s deadly T-virus continues to ravage the Earth, transforming the global population into legions of the flesh eating Undead. The human race’s last and only hope, Alice, awakens in the heart of Umbrella’s most clandestine operations facility and unveils more of her mysterious past as she delves further into the complex. Without a safe haven, Alice continues to hunt those responsible for the outbreak; a chase that takes her from Tokyo to New York, Washington, D.C. and Moscow, culminating in a mind-blowing revelation that will force her to rethink everything that she once thought to be true. Aided by new found allies and familiar friends, Alice must fight to survive long enough to escape a hostile world on the brink of oblivion. The countdown has begun.",1,2012,95,Movie
684,Death Race,Action,Universal Pictures,"Terminal Island, New York: 2020. Overcrowding in the US penal system has reached a breaking point. Prisons have been turned over to a monolithic Weyland Corporation, which sees jails full of thugs as an opportunity for televised sport. Adrenalized inmates, a global audience hungry for violence and a spectacular, enclosed arena come together to form the 'Death Race', the biggest, most brutal event.",1,2008,105,Movie
685,The Long Kiss Goodnight,Crime,New Line Cinema,"Samantha Caine, suburban homemaker, is the ideal mom to her 8 year old daughter Caitlin. She lives in Honesdale, PA, has a job teaching school and makes the best Rice Krispie treats in town. But when she receives a bump on her head, she begins to remember small parts of her previous life as a lethal, top-secret agent",1,1996,120,Movie
686,Proof of Life,Action,Castle Rock Entertainment,"Alice hires a professional negotiator to obtain the release of her engineer husband, who has been kidnapped by anti-government guerrillas in South America.",1,2000,135,Movie
687,Zathura: A Space Adventure,Family,Columbia Pictures Corporation,"After their father is called into work, two young boys, Walter and Danny, are left in the care of their teenage sister, Lisa, and told they must stay inside. Walter and Danny, who anticipate a boring day, are shocked when they begin playing Zathura, a space-themed board game, which they realize has mystical powers when their house is shot into space. With the help of an astronaut, the boys attempt to return home.",1,2005,101,Movie
688,Fight Club,Drama,Regency Enterprises,"A ticking-time-bomb insomniac and a slippery soap salesman channel primal male aggression into a shocking new form of therapy. Their concept catches on, with underground ""fight clubs"" forming in every town, until an eccentric gets in the way and ignites an out-of-control spiral toward oblivion.",1,1999,139,Movie
689,We Are Marshall,Drama,Legendary Pictures,"When a plane crash claims the lives of members of the Marshall University football team and some of its fans, the team's new coach and his surviving players try to keep the football program alive.",1,2006,124,Movie
690,Hudson Hawk,Action,TriStar Pictures,"Eddie Hawkins, called Hudson Hawk has just been released from ten years of prison and is planning to spend the rest of his life honestly. But then the crazy Mayflower couple blackmail him to steal some of the works of Leonardo da Vinci. If he refuses, they threaten to kill his friend Tommy.",1,1991,100,Movie
691,Lucky Numbers,Action,Paramount Pictures,"Russ Richards is a TV weatherman and local celebrity on the verge of losing his shirt. Desperate to escape financial ruin, he schemes with Crystal the TV station's lotto ball girl to rig the state lottery drawing. The numbers come up right, but everything else goes wrong as the plan starts to unravel and the game turns rough.",1,2000,105,Movie
692,"I, Frankenstein",Horror,Lakeshore Entertainment,"200 years after his shocking creation, Dr. Frankenstein's creature, Adam, still walks the earth. But when he finds himself in the middle of a war over the fate of humanity, Adam discovers he holds the key that could destroy humankind.",1,2014,92,Movie
693,Oliver Twist,Crime,R.P. Productions,"Oliver Twist the modern filmed version of Charles Dickens bestseller, a Roman Polanski adaptation. The classic Dickens tale, where an orphan meets a pickpocket on the streets of London. From there, he joins a household of boys who are trained to steal for their master.",1,2005,130,Movie
694,Elektra,Action,Twentieth Century Fox Film Corporation,"Elektra the warrior survives a near-death experience, becomes an assassin-for-hire, and tries to protect her two latest targets, a single father and his young daughter, from a group of supernatural assassins.",1,2005,97,Movie
695,Sin City: A Dame to Kill For,Crime,Miramax Films,Some of Sin City's most hard-boiled citizens cross paths with a few of its more reviled inhabitants.,1,2014,102,Movie
696,Random Hearts,Drama,Columbia Pictures,After the death of their loved ones in a tragic plane crash 'Harrison Ford' and Kristin Scott Thomas find each others keys in each others loved ones posessions and realize that they were having an affair and must figure out all the details. Written by Andy HeitzThe wife of Police Sergeant Dutch Van Den Broek and the husband of politician Kay Chandler are killed in a plane crash. Now Dutch discovers some anomalies in what he told her before she left and discovers that she and Chandler's husband were travelling together. Dutch then goes to Chandler and tells her that he suspects that they were having an affair. He tells her that he wants to know the truth; she tells him that she doesn't but she later joins him and they grow close.,1,1999,133,Movie
697,Everest,Adventure,Universal Pictures,"Inspired by the incredible events surrounding a treacherous attempt to reach the summit of the world's highest mountain, ""Everest"" documents the awe-inspiring journey of two different expeditions challenged beyond their limits by one of the fiercest snowstorms ever encountered by mankind. Their mettle tested by the harshest of elements found on the planet, the climbers will face nearly impossible obstacles as a lifelong obsession becomes a breathtaking struggle for survival.",1,2015,121,Movie
698,Perfume: The Story of a Murderer,Crime,Davis-Films,"Jean-Baptiste Grenouille, born in the stench of 18th century Paris, develops a superior olfactory sense, which he uses to create the world's finest perfumes. However, his work takes a dark turn as he tries to preserve scents in the search for the ultimate perfume.",1,2006,147,Movie
699,Austin Powers in Goldmember,Comedy,New Line Cinema,"The world's most shagadelic spy continues his fight against Dr. Evil. This time, the diabolical doctor and his clone, Mini-Me, team up with a new foe -- '70s kingpin Goldmember. While pursuing the team of villains to stop them from world domination, Austin gets help from his dad and an old girlfriend.",1,2002,94,Movie
700,Astro Boy,Animation,The Weinstein Company,"Set in futuristic Metro City, Astro Boy is about a young robot with incredible powers created by a brilliant scientist in the image of the son he has lost. Unable to fulfill the grieving man's expectations, our hero embarks on a journey in search of acceptance, experiencing betrayal and a netherworld of robot gladiators, before he returns to save Metro City and reconcile with the father who had rejected him.",1,2009,94,Movie
701,Jurassic Park,Adventure,Universal Pictures,"A wealthy entrepreneur secretly creates a theme park featuring living dinosaurs drawn from prehistoric DNA. Before opening day, he invites a team of experts and his two eager grandchildren to experience the park and help calm anxious investors. However, the park is anything but amusing as the security systems go off-line and the dinosaurs escape.",1,1993,127,Movie
702,Wyatt Earp,Drama,Tig Productions,"Covering the life and times of one of the West's most iconic heroes Wyatt Earp weaves an intricate tale of Earp and his friends and family. With a star studded cast, sweeping cinematography and authentic costumes Wyatt Earp led the way during the Western revival in the 90's.",1,1994,191,Movie
703,Dreamer: Inspired By a True Story,Drama,DreamWorks SKG,Ben Crane believes that a severely injured racehorse deserves another chance. He and his daughter Cale adopt the horse (in fact is a mare)and save it of being sacrificed by the owner.,1,2005,106,Movie
704,Clear and Present Danger,Action,Paramount Pictures,CIA Analyst Jack Ryan is drawn into an illegal war fought by the US government against a Colombian drug cartel.,1,1994,141,Movie
705,天將雄師,Action,Shanghai Film Group,"Huo An, the commander of the Protection Squad of the Western Regions, was framed by evil forces and becomes enslaved. On the other hand, a Roman general escapes to China after rescuing the Prince. The heroic duo meet in the Western Desert and a thrilling story unfolds.",1,2015,127,Movie
784,Planet 51,Science Fiction,TriStar Pictures,"When Earth astronaut Capt. Chuck Baker arrives on Planet 51 -- a world reminiscent of American suburbia circa 1950 -- he tries to avoid capture, recover his spaceship and make it home safely, all with the help of an empathetic little green being.",1,2009,91,Movie
706,Little Man,Comedy,Revolution Studios,"After leaving the prison, the dwarf criminal Calvin Sims joins to his moron brother Percy to steal an expensive huge diamond in a jewelry for the mobster Walken. They are chased by the police, and Calvin hides the stone in the purse of the executive Vanessa Edwards, whose husband Darryl Edwards wants to have a baby. Percy convinces Calvin to dress like a baby and be left in front of the Edwards's house to get inside the house and retrieve the diamond. Darryl and Vanessa keep Calvin for the weekend and decide to adopt him, while Walken threatens Darryl to get the stone back.",1,2006,98,Movie
707,U-571,Action,Universal Pictures,"In the midst of World War II, the battle under the sea rages and the Nazis have the upper hand as the Allies are unable to crack their war codes. However, after a wrecked U-boat sends out an SOS signal, the Allies realise this is their chance to seize the 'enigma coding machine'.",1,2000,116,Movie
708,The American President,Comedy,Columbia Pictures,"Widowed U.S. president Andrew Shepherd, one of the world's most powerful men, can have anything he wants -- and what he covets most is Sydney Ellen Wade, a Washington lobbyist. But Shepherd's attempts at courting her spark wild rumors and decimate his approval ratings.",1,1995,106,Movie
709,The Love Guru,Comedy,Paramount Pictures,"Born in America and raised in an Indian ashram, Pitka returns to his native land to seek his fortune as a spiritualist and self-help expert. His skills are put to the test when he must get a brokenhearted hockey player's marriage back on track in time for the man to help his team win the Stanley Cup.",1,2008,87,Movie
710,Boat Trip,Comedy,Motion Picture Corporation of America,"Two straight men mistakenly end up on a ""gays only"" cruise.",1,2002,94,Movie
711,3000 Miles to Graceland,Action,Franchise Pictures,"It was an ingenious enough plan: rob the Riviera Casino's count room during an Elvis impersonator convention. But Thomas Murphy decided to keep all the money for himself and shot all his partners, including recently-freed ex-con Michael Zane. With $3.2 million at stake, the Marshals Service closing in, Michael must track down Murphy.",1,2001,125,Movie
712,The Hateful Eight,Crime,Double Feature Films,Bounty hunters seek shelter from a raging blizzard and get caught up in a plot of betrayal and deception.,1,2015,167,Movie
713,Blades of Glory,Action,DreamWorks,"When a much-publicized ice-skating scandal strips them of their gold medals, two world-class athletes skirt their way back onto the ice via a loophole that allows them to compete together as a pairs team.",1,2007,93,Movie
714,Hop,Animation,Universal Pictures,"E.B., the Easter Bunny's teenage son, heads to Hollywood, determined to become a drummer in a rock 'n' roll band. In LA, he's taken in by Fred after the out-of-work slacker hits E.B. with his car.",1,2011,95,Movie
715,300,Action,Virtual Studios,"Based on Frank Miller's graphic novel, ""300"" is very loosely based the 480 B.C. Battle of Thermopylae, where the King of Sparta led his army against the advancing Persians; the battle is said to have inspired all of Greece to band together against the Persians, and helped usher in the world's first democracy.",1,2006,117,Movie
716,Meet the Fockers,Comedy,DreamWorks SKG,"Hard-to-crack ex-CIA man, Jack Byrnes and his wife, Dina head for the warmer climes of Florida to meet son-in-law-to-be, Greg Focker's parents. Unlike their happily matched offspring, the future in-laws find themselves in a situation of opposites that definitely do not attract.",1,2004,115,Movie
717,Marley & Me,Comedy,Sunswept Entertainment,"A newly married couple who, in the process of starting a family, learn many of life's important lessons from their trouble-loving retriever, Marley. Packed with plenty of laughs to lighten the load, the film explores the highs and lows of marriage, maturity and confronting one's own mortality, as seen through the lens of family life with a dog.",1,2008,115,Movie
718,The Green Mile,Fantasy,Castle Rock Entertainment,"A supernatural tale set on death row in a Southern prison, where gentle giant John Coffey possesses the mysterious power to heal people's ailments. When the cellblock's head guard, Paul Edgecomb, recognizes Coffey's miraculous gift, he tries desperately to help stave off the condemned man's execution.",1,1999,189,Movie
719,Wild Hogs,Action,Wild Hogs Productions,"Restless and ready for adventure, four suburban bikers leave the safety of their subdivision and head out on the open road. But complications ensue when they cross paths with an intimidating band of New Mexico bikers known as the Del Fuegos.",1,2007,100,Movie
720,Chicken Little,Animation,Walt Disney Pictures,"When the sky really is falling and sanity has flown the coop, who will rise to save the day? Together with his hysterical band of misfit friends, Chicken Little must hatch a plan to save the planet from alien invasion and prove that the world's biggest hero is a little chicken.",1,2005,81,Movie
721,Gone Girl,Mystery,Twentieth Century Fox Film Corporation,"With his wife's disappearance having become the focus of an intense media circus, a man sees the spotlight turned on him when it's suspected that he may not be innocent.",1,2014,145,Movie
722,The Bourne Identity,Action,Universal Pictures,"Wounded to the brink of death and suffering from amnesia, Jason Bourne is rescued at sea by a fisherman. With nothing to go on but a Swiss bank account number, he starts to reconstruct his life, but finds that many people he encounters want him dead. However, Bourne realizes that he has the combat and mental skills of a world-class spy – but who does he work for?",1,2002,119,Movie
723,Cats & Dogs,Comedy,Village Roadshow Pictures,"When a professor develops a vaccine that eliminates human allergies to dogs, he unwittingly upsets the fragile balance of power between cats and dogs and touches off an epic battle for pet supremacy. The fur flies as the feline faction, led by Mr. Tinkles, squares off against wide-eyed puppy Lou and his canine cohorts.",1,2001,87,Movie
724,GoldenEye,Adventure,United Artists,James Bond must unmask the mysterious head of the Janus Syndicate and prevent the leader from utilizing the GoldenEye weapons system to inflict devastating revenge on Britain.,1,1995,130,Movie
725,The General's Daughter,Crime,Paramount Pictures,"When the body of Army Capt. Elizabeth Campbell is found on a Georgia military base, two investigators, Warrant Officers Paul Brenner and Sara Sunhill, are ordered to solve her murder. What they uncover is anything but clear-cut. Unseemly details emerge about Campbell's life, leading to allegations of a possible military coverup of her death and the involvement of her father, Lt. Gen. Joseph Campbell.",1,1999,116,Movie
726,The Truman Show,Comedy,Paramount Pictures,"Truman Burbank is the star of ""The Truman Show"", a 24-hour-a-day ""reality"" TV show that broadcasts every aspect of his life -- live and in color -- without his knowledge. His entire life has been an unending soap opera for consumption by the rest of the world. And everyone he knows -- including his wife and his best friend -- is really an actor, paid to be part of his life.",1,1998,103,Movie
727,The Prince of Egypt,Adventure,DreamWorks SKG,"This is the extraordinary tale of two brothers named Moses and Ramses, one born of royal blood, and one an orphan with a secret past. Growing up the best of friends, they share a strong bond of free-spirited youth and good-natured rivalry. But the truth will ultimately set them at odds, as one becomes the ruler of the most powerful empire on earth, and the other the chosen leader of his people! Their final confrontation will forever change their lives and the world.",1,1998,99,Movie
728,Daddy Day Care,Comedy,Columbia Pictures,"Two men get laid off and have to become stay-at-home dads when they can't find jobs, which inspires them to open their own day-care center.",1,2003,92,Movie
729,2 Guns,Action,Universal Studios,A DEA agent and an undercover Naval Intelligence officer who have been tasked with investigating one another find they have been set up by the mob -- the very organization the two men believe they have been stealing money from.,1,2013,109,Movie
730,Crazy in Alabama,Comedy,Columbia Pictures,An abused wife heads to California to become a movie star while her nephew back in Alabama has to deal with a racially-motivated murder involving a corrupt sheriff.,1,1999,111,Movie
731,The Italian Job,Action,De Line Pictures,"Charlie Croker pulled off the crime of a lifetime. The one thing that he didn't plan on was being double-crossed. Along with a drop-dead gorgeous safecracker, Croker and his team take off to re-steal the loot and end up in a pulse-pounding, pedal-to-the-metal chase that careens up, down, above and below the streets of Los Angeles.",1,2003,110,Movie
732,Two Weeks Notice,Romance,Village Roadshow Pictures,"Dedicated environmental lawyer Lucy Kelson goes to work for billionaire George Wade as part of a deal to preserve a community center. Indecisive and weak-willed George grows dependent on Lucy's guidance on everything from legal matters to clothing. Exasperated, Lucy gives notice and picks Harvard graduate June Carter as her replacement. As Lucy's time at the firm nears an end, she grows jealous of June and has second thoughts about leaving George.",1,2002,101,Movie
733,Antz,Adventure,DreamWorks SKG,"In this animated hit, a neurotic worker ant in love with a rebellious princess rises to unlikely stardom when he switches places with a soldier. Signing up to march in a parade, he ends up under the command of a bloodthirsty general. But he's actually been enlisted to fight against a termite army.",1,1998,83,Movie
734,Couples Retreat,Comedy,Universal Pictures,"Four couples, all friends, descend on a tropical island resort. Though one husband and wife are there to work on their marriage, the others just want to enjoy some fun in the sun. They soon find, however, that paradise comes at a price: Participation in couples therapy sessions is mandatory. What started out as a cut-rate vacation turns into an examination of the common problems many face.",1,2009,113,Movie
735,Days of Thunder,Adventure,Paramount Pictures,"Talented but unproven stock car driver Cole Trickle gets a break and with the guidance of veteran Harry Hogge turns heads on the track. The young hotshot develops a rivalry with a fellow racer that threatens his career when the two smash their cars. But with the help of his doctor, Cole just might overcome his injuries-- and his fear.",1,1990,107,Movie
736,Cheaper by the Dozen 2,Comedy,Twentieth Century Fox Film Corporation,"Steve Martin and Bonnie Hunt return as heads of the Baker family who, while on vacation, find themselves in competition with a rival family of eight children, headed by Eugene Levy,",1,2005,94,Movie
737,Maze Runner: The Scorch Trials,Action,Gotham Group,"Thomas and his fellow Gladers face their greatest challenge yet: searching for clues about the mysterious and powerful organization known as WCKD. Their journey takes them to the Scorch, a desolate landscape filled with unimaginable obstacles. Teaming up with resistance fighters, the Gladers take on WCKD’s vastly superior forces and uncover its shocking plans for them all.",1,2015,132,Movie
738,Eat Pray Love,Drama,Columbia Pictures,"Liz Gilbert had everything a modern woman is supposed to dream of having – a husband, a house and a successful career – yet like so many others, she found herself lost, confused and searching for what she really wanted in life. Newly divorced and at a crossroads, Gilbert steps out of her comfort zone, risking everything to change her life, embarking on a journey around the world that becomes a quest for self-discovery. In her travels, she discovers the true pleasure of nourishment by eating in Italy, the power of prayer in India and, finally and unexpectedly, the inner peace and balance of true love in Bali.",1,2010,133,Movie
